Title,Author,Goodreads Rating,Kindle Price,Hardcover Price New,Hardcover Price Used,Paperback Price New,Paperback Price New,link
"Family Romance: A Love Story","John Lanchester","3.86","6.02","—","1.26","8.19","2.00","https://www.amazon.co.uk/gp/product/0399153004"
"Fragrant Harbour","John Lanchester","3.77","5.03","—","1.00","6.99","1.78","https://www.amazon.co.uk/gp/product/057121469X"
"Leaving Atlanta","Tayari Jones","4.00","6.99","—","8.58","—","11.82","https://www.amazon.co.uk/gp/product/0446690899"
"Silver Sparrow","Tayari Jones","3.87","—","—","13.41","—","24.11","https://www.amazon.co.uk/gp/product/1565129903"
"The Ragged Trousered Philanthropists","Robert Tressell","3.98","0.00","19.99","37.57","2.25","0.99","https://www.amazon.co.uk/gp/product/0586090363"
"Waterlog","Roger  Deakin","4.32","5.49","—","82.00","8.19","8.93","https://www.amazon.co.uk/gp/product/0099282550"
"Nudge: Improving Decisions About Health, Wealth, and Happiness","Richard H. Thaler","3.84","5.49","15.76","5.44","8.19","5.38","https://www.amazon.co.uk/gp/product/014311526X"
"Misbehaving: The Making of Behavioral Economics","Richard H. Thaler","4.18","5.49","—","31.01","8.19","9.49","https://www.amazon.co.uk/gp/product/039335279X"
"Test Driven Development: By Example","Kent Beck","4.07","—","—","—","28.40","24.99","https://www.amazon.co.uk/gp/product/0321146530"
"Overcoming Relationship Problems","Michael Crowe","3.42","3.99","—","—","—","0.50","https://www.amazon.co.uk/gp/product/1845290666"
"Little Man, What Now?","Hans Fallada","3.99","4.99","—","45.53","7.37","—","https://www.amazon.co.uk/gp/product/0897330862"
"My Wild and Sleepless Nights: A Mother's Story","Clover Stroud","4.23","9.99","10.80","12.82","—","—","https://www.amazon.co.uk/gp/product/0857525905"
"How to Have Impossible Conversations: A Very Practical Guide","Peter Boghossian","4.09","7.99","—","—","10.96","12.37","https://www.amazon.co.uk/gp/product/0738285323"
"The Hate U Give","Angie Thomas","4.51","6.22","13.49","12.46","6.55","2.83","https://www.amazon.co.uk/gp/product/0062498533"
"Why I'm No Longer Talking to White People About Race","Reni Eddo-Lodge","4.37","5.78","16.99","8.75","7.37","7.81","https://www.amazon.co.uk/gp/product/140887055X"
"La Belle Sauvage (The Book of Dust, #1)","Philip Pullman","4.17","4.99","15.48","1.61","4.00","6.65","https://www.amazon.co.uk/gp/product/0375815309"
"Another Day in the Death of America: A Chronicle of Ten Short Lives","Gary Younge","4.23","4.31","13.59","0.70","8.19","1.20","https://www.amazon.co.uk/gp/product/1568589751"
"A Horse Walks into a Bar","David Grossman","3.53","4.99","—","0.70","6.99","0.01","https://www.amazon.co.uk/gp/product/0451493974"
"Meetings with Remarkable Manuscripts","Christopher de Hamel","4.45","4.49","—","11.60","9.99","10.87","https://www.amazon.co.uk/gp/product/0241003040"
"The Sellout","Paul Beatty","3.76","1.99","—","5.05","7.37","2.99","https://www.amazon.co.uk/gp/product/0374260508"
"East West Street: On the Origins of "Genocide" and "Crimes Against Humanity"","Philippe Sands","4.47","5.99","—","9.99","8.19","8.93","https://www.amazon.co.uk/gp/product/0385350716"
"Between the World and Me","Ta-Nehisi Coates","4.39","5.15","—","—","5.42","—","https://www.amazon.co.uk/gp/product/0812993543"
"The Sixth Extinction: An Unnatural History","Elizabeth Kolbert","4.13","7.17","—","—","—","14.77","https://www.amazon.co.uk/gp/product/0805092994"
"The Miniaturist","Jessie Burton","3.60","3.99","—","0.50","7.37","0.49","https://www.amazon.co.uk/gp/product/0062306812"
"Being Mortal: Medicine and What Matters in the End","Atul Gawande","4.45","4.74","24.79","29.77","8.19","7.95","https://www.amazon.co.uk/gp/product/0805095152"
"The Reason I Jump: The Inner Voice of a Thirteen-Year-Old Boy with Autism","Naoki Higashida","3.82","6.99","—","3.65","8.19","3.36","https://www.amazon.co.uk/gp/product/0812994868"
"The Luminaries","Eleanor Catton","3.73","6.99","—","1.50","8.19","1.69","https://www.amazon.co.uk/gp/product/0316074314"
"Capital in the Twenty-First Century","Thomas Piketty","4.04","11.02","26.47","18.36","14.99","16.60","https://www.amazon.co.uk/gp/product/067443000X"
"A Card from Angela Carter","Susannah Clapp","3.74","6.90","—","1.91","—","1.37","https://www.amazon.co.uk/gp/product/1408826909"
"On the Map: A Mind-Expanding Exploration of the Way the World Looks","Simon Garfield","3.67","4.27","—","0.70","8.80","2.34","https://www.amazon.co.uk/gp/product/159240779X"
"The Garden of Evening Mists","Tan Twan Eng","4.11","4.53","18.99","1.59","7.37","8.28","https://www.amazon.co.uk/gp/product/1905802498"
"Now All Roads Lead To France","Matthew Hollis","4.08","5.03","—","0.68","10.65","1.00","https://www.amazon.co.uk/gp/product/0571245986"
"Why Be Happy When You Could Be Normal?","Jeanette Winterson","3.98","5.49","—","19.93","—","6.78","https://www.amazon.co.uk/gp/product/0307401243"
"The Immortal Life of Henrietta Lacks","Rebecca Skloot","4.06","5.99","—","—","8.99","9.13","https://www.amazon.co.uk/gp/product/1400052173"
"Slow Horses (Slough House, #1)","Mick Herron","3.87","—","—","—","—","—","https://www.amazon.co.uk/gp/product/1569479011"
"Homicide: A Year on the Killing Streets","David Simon","4.38","5.03","—","12.72","10.65","6.84","https://www.amazon.co.uk/gp/product/0805080759"
"Leviathan: Or, The Whale","Philip Hoare","3.95","6.49","—","34.94","9.99","1.60","https://www.amazon.co.uk/gp/product/0007230141"
"Olive Kitteridge (Olive Kitteridge, #1)","Elizabeth Strout","3.83","5.99","—","—","6.99","5.89","https://www.amazon.co.uk/gp/product/140006208X"
"Fun Home: A Family Tragicomic","Alison Bechdel","4.09","—","—","—","10.65","10.00","https://www.amazon.co.uk/gp/product/0618871713"
"The Inheritance of Loss","Kiran Desai","3.43","4.99","—","0.98","8.99","0.01","https://www.amazon.co.uk/gp/product/0802142818"
"Arthur & George","Julian Barnes","3.70","4.99","—","1.00","8.19","1.07","https://www.amazon.co.uk/gp/product/1400097037"
"Travels with Herodotus","Ryszard Kapuściński","4.06","3.99","—","22.70","2.99","1.08","https://www.amazon.co.uk/gp/product/1400043387"
"Watching the English: The Hidden Rules of English Behaviour","Kate Fox","3.92","—","—","1.00","—","1.00","https://www.amazon.co.uk/gp/product/0340752122"
"Reading Lolita in Tehran: A Memoir in Books","Azar Nafisi","3.61","—","—","1.25","—","1.19","https://www.amazon.co.uk/gp/product/081297106X"
"London Orbital","Iain Sinclair","3.67","4.99","—","4.06","9.01","2.49","https://www.amazon.co.uk/gp/product/0141014741"
"Bel Canto","Ann Patchett","3.93","2.99","—","14.29","8.99","1.65","https://www.amazon.co.uk/gp/product/0060838728"
"The Secret Life of Bees","Sue Monk Kidd","4.05","5.99","18.61","16.42","7.37","1.23","https://www.amazon.co.uk/gp/product/0142001740"
"English Passengers","Matthew Kneale","4.06","4.99","—","6.40","—","4.05","https://www.amazon.co.uk/gp/product/038549744X"
"Bad Blood","Lorna Sage","3.54","4.99","—","0.50","2.97","0.01","https://www.amazon.co.uk/gp/product/0060938080"
"With the End in Mind: Dying, Death, and Wisdom in an Age of Denial","Kathryn Mannix","4.57","0.99","—","11.38","8.19","9.34","https://www.amazon.co.uk/gp/product/0316504483"
"Tales from Outer Suburbia","Shaun Tan","4.32","7.22","9.55","5.22","—","—","https://www.amazon.co.uk/gp/product/0771084021"
"A Youthful Diary","Daisaku Ikeda","4.64","—","—","23.82","—","9.57","https://www.amazon.co.uk/gp/product/0915678683"
"Twas the Nightshift Before Christmas","Adam Kay","4.19","2.99","6.99","2.79","—","—","https://www.amazon.co.uk/gp/product/1529018587"
"The Righteous Mind: Why Good People Are Divided by Politics and Religion","Jonathan Haidt","4.22","7.99","—","25.95","10.65","10.87","https://www.amazon.co.uk/gp/product/0307377903"
"Mauve: How One Man Invented a Colour That Changed the World","Simon Garfield","3.69","5.03","—","—","8.19","6.00","https://www.amazon.co.uk/gp/product/0393323137"
"Death in the East (Sam Wyndham # 4)","Abir  Mukherjee","4.35","6.99","9.72","12.61","6.99","—","https://www.amazon.co.uk/gp/product/1787300579"
"Somewhere Becoming Rain: Collected Writings on Philip Larkin","Clive James","4.14","7.99","9.56","4.48","—","—","https://www.amazon.co.uk/gp/product/1529028825"
"The Topeka School","Ben Lerner","3.61","—","—","—","—","—","https://www.amazon.co.uk/gp/product/0374277788"
"The Wall","John Lanchester","3.63","4.68","14.99","6.00","7.37","5.20","https://www.amazon.co.uk/gp/product/1324001631"
"Girl, Woman, Other","Bernardine Evaristo","4.43","4.99","12.90","7.54","—","10.77","https://www.amazon.co.uk/gp/product/0241364906"
"Fleishman Is in Trouble","Taffy Brodesser-Akner","3.70","5.99","15.19","9.34","6.99","—","https://www.amazon.co.uk/gp/product/0525510877"
"Autumn Light: Season of Fire and Farewells","Pico Iyer","4.02","5.78","12.24","9.43","7.37","8.28","https://www.amazon.co.uk/gp/product/0451493931"
"Sour: More Than Mere Taste: the Magical Element that Transforms Your Cooking","Mark Diacono","4.43","10.79","25.00","16.87","—","—","https://www.amazon.co.uk/gp/product/1787132269"
"Time and How to Spend It: The 7 Rules for Richer, Happier Days","James Wallman","3.48","—","—","—","—","—","https://www.amazon.co.uk/gp/product/0753552663"
"The Weather Machine: A Journey Inside the Forecast","Andrew  Blum","3.43","9.99","16.99","—","—","31.30","https://www.amazon.co.uk/gp/product/0062368613"
"Without the Banya We Would Perish: A History of the Russian Bathhouse","Ethan Pollock","4.00","19.97","21.02","22.00","—","—","https://www.amazon.co.uk/gp/product/0195395484"
"The Boundless Sea: A Human History of the Oceans","David Abulafia","4.26","14.99","23.93","22.18","18.99","—","https://www.amazon.co.uk/gp/product/1846145082"
"Legacy: One Family, a Cup of Tea and the Company that Took On the World","Thomas Harding","4.19","12.99","14.15","18.96","9.67","—","https://www.amazon.co.uk/gp/product/1785150898"
"21 Letters on Life and Its Challenges","Charles Handy","4.43","4.99","13.59","9.05","9.99","6.42","https://www.amazon.co.uk/gp/product/1786331950"
"Range: Why Generalists Triumph in a Specialized World","David   Epstein","4.18","9.99","15.30","15.37","—","—","https://www.amazon.co.uk/gp/product/0735214484"
"Anxious Times: Medicine and Modernity in Nineteenth-Century Britain","Amelia Bonea","3.00","36.58","38.50","—","—","—","https://www.amazon.co.uk/gp/product/0822945517"
"Narrative Economics: How Stories Go Viral and Drive Major Economic Events","Robert J. Shiller","3.63","12.04","18.00","11.00","14.99","—","https://www.amazon.co.uk/gp/product/0691182299"
"Extreme Economies: Survival, Failure, Future – Lessons from the World’s Limits","Richard  Davies","4.19","9.99","15.42","12.50","9.99","—","https://www.amazon.co.uk/gp/product/1787631990"
"Unbound: How Inequality Constricts Our Economy and What We Can Do about It","Heather Boushey","4.40","12.28","12.93","11.58","—","—","https://www.amazon.co.uk/gp/product/0674919319"
"Last Days of the Bus Club","Chris  Stewart","4.01","3.79","—","—","9.99","7.89","https://www.amazon.co.uk/gp/product/1908745436"
"The Miracle of Castel di Sangro: A Tale of Passion and Folly in the Heart of Italy","Joe McGinniss","4.17","—","—","5.89","11.99","11.36","https://www.amazon.co.uk/gp/product/0767905997"
"We Are All Stardust: Leading Scientists Talk About Their Work, Their Lives, and the Mysteries of Our Existence","Stefan Klein","4.15","9.49","—","—","9.99","1.69","https://www.amazon.co.uk/gp/product/1615190597"
"Dealers of Lightning: Xerox PARC and the Dawn of the Computer Age","Michael A. Hiltzik","4.12","—","—","10.18","—","11.11","https://www.amazon.co.uk/gp/product/0887309895"
"Mrs. Everything","Jennifer Weiner","3.85","4.99","—","8.85","8.99","8.86","https://www.amazon.co.uk/gp/product/1501133489"
"Save Me the Plums: My Gourmet Memoir","Ruth Reichl","4.10","—","17.59","11.05","14.48","—","https://www.amazon.co.uk/gp/product/1400069998"
"Will My Cat Eat My Eyeballs? Big Questions from Tiny Mortals About Death","Caitlin Doughty","4.17","7.99","14.99","8.29","10.65","10.87","https://www.amazon.co.uk/gp/product/039365270X"
"Underland","Robert Macfarlane","4.24","7.99","16.00","13.40","8.99","—","https://www.amazon.co.uk/gp/product/0393242145"
"Invisible Women: Data Bias in a World Designed for Men","Caroline Criado Perez","4.44","—","—","20.69","13.75","—","https://www.amazon.co.uk/gp/product/1419729071"
"How To: Absurd Scientific Advice for Common Real-World Problems","Randall Munroe","4.19","8.99","13.59","9.51","11.91","—","https://www.amazon.co.uk/gp/product/0525537090"
"Never Enough: The Neuroscience and Experience of Addiction","Judith Grisel","4.06","5.84","—","17.46","6.15","2.55","https://www.amazon.co.uk/gp/product/0385542844"
"Blueprint: The Evolutionary Origins of a Good Society","Nicholas A. Christakis","3.94","9.99","23.26","7.00","8.99","8.81","https://www.amazon.co.uk/gp/product/0316230030"
"Say Nothing: A True Story of Murder and Memory in Northern Ireland","Patrick Radden Keefe","4.43","7.49","10.83","15.41","9.99","10.77","https://www.amazon.co.uk/gp/product/0385521316"
"Upheaval: Turning Points for Nations in Crisis","Jared Diamond","3.85","—","—","33.91","18.49","—","https://www.amazon.co.uk/gp/product/0316409138"
"How to Hide an Empire: A History of the Greater United States","Daniel Immerwahr","4.45","—","—","45.99","15.50","—","https://www.amazon.co.uk/gp/product/0374172145"
"Maybe You Should Talk to Someone: A Therapist, Her Therapist, and Our Lives Revealed","Lori Gottlieb","4.38","1.99","—","—","14.99","—","https://www.amazon.co.uk/gp/product/1328662055"
"Furious Hours: Murder, Fraud, and the Last Trial of Harper Lee","Casey Cep","3.81","9.99","16.00","12.41","7.99","—","https://www.amazon.co.uk/gp/product/1101947861"
"American Predator: The Hunt for the Most Meticulous Serial Killer of the 21st Century","Maureen Callahan","4.08","11.99","22.99","17.89","11.96","—","https://www.amazon.co.uk/gp/product/052542864X"
"The Unwinding of the Miracle: A Memoir of Life, Death, and Everything That Comes After","Julie Yip-Williams","4.11","0.99","7.87","3.93","12.99","8.16","https://www.amazon.co.uk/gp/product/0525511350"
"Long Live the Tribe of Fatherless Girls","T. Kira Madden","4.30","—","16.99","—","13.95","—","https://www.amazon.co.uk/gp/product/1635571855"
"Inheritance: A Memoir of Genealogy, Paternity, and Love","Dani Shapiro","3.91","5.69","—","—","8.19","8.93","https://www.amazon.co.uk/gp/product/1524732710"
"Maid: Hard Work, Low Pay, and a Mother's Will to Survive","Stephanie  Land","3.73","7.99","14.99","12.16","8.99","—","https://www.amazon.co.uk/gp/product/0316505110"
"More Than Enough: Claiming Space for Who You Are (No Matter What They Say)","Elaine Welteroth","4.40","4.99","—","13.64","11.99","12.16","https://www.amazon.co.uk/gp/product/0525561587"
"Prognosis: A Memoir of My Brain","Sarah Vallance","3.86","3.98","13.91","8.49","8.99","—","https://www.amazon.co.uk/gp/product/1542043026"
"A Woman Is No Man","Etaf Rum","4.24","—","—","—","—","—","https://www.amazon.co.uk/gp/product/0062699768"
"Ask Again, Yes","Mary Beth Keane","4.01","9.99","11.99","12.16","8.99","—","https://www.amazon.co.uk/gp/product/1982106980"
"On Earth We're Briefly Gorgeous","Ocean Vuong","4.06","5.99","10.59","7.78","7.49","—","https://www.amazon.co.uk/gp/product/0525562028"
"Where the Forest Meets the Stars","Glendy Vanderah","4.16","1.99","19.99","—","4.99","17.00","https://www.amazon.co.uk/gp/product/154204006X"
"Queenie","Candice Carty-Williams","3.76","4.99","10.65","5.00","6.29","8.73","https://www.amazon.co.uk/gp/product/1501196014"
"England: Poems from a School","Kate Clanchy","4.64","6.99","—","—","7.55","5.20","https://www.amazon.co.uk/gp/product/1509886605"
"Newborn","Kate Clanchy","4.28","5.99","—","—","—","49.40","https://www.amazon.co.uk/gp/product/0330419315"
"Bad Blood: Secrets and Lies in a Silicon Valley Startup","John Carreyrou","4.44","3.99","—","16.95","6.96","—","https://www.amazon.co.uk/gp/product/152473165X"
"The Body: A Guide for Occupants","Bill Bryson","4.32","8.99","12.50","17.35","—","19.91","https://www.amazon.co.uk/gp/product/0385539304"
"Gotta Get Theroux This: My Life and Strange Times in Television","Louis Theroux","3.98","5.99","15.30","7.82","8.99","—","https://www.amazon.co.uk/gp/product/1509880364"
"Moby-Dick or, the Whale","Herman Melville","3.50","0.00","7.99","10.16","2.25","1.07","https://www.amazon.co.uk/gp/product/0142437247"
"Two Caravans","Marina Lewycka","3.50","2.99","—","3.45","8.99","1.50","https://www.amazon.co.uk/gp/product/1905490321"
"Aroused: The History of Hormones and How They Control Just About Everything","Randi Hutter Epstein","3.88","6.64","16.99","5.05","11.03","11.03","https://www.amazon.co.uk/gp/product/0393357082"
"Grime Kids: The Inside Story of the Global Grime Takeover","Dj Target","3.93","3.99","16.99","—","7.37","—","https://www.amazon.co.uk/gp/product/1409179516"
"Beloved","Toni Morrison","3.84","4.99","11.02","8.79","7.99","5.28","https://www.amazon.co.uk/gp/product/1400033411"
"West","Carys Davies","3.72","6.02","—","—","7.37","5.39","https://www.amazon.co.uk/gp/product/1501179349"
"The Perseverance","Raymond Antrobus","4.33","5.63","—","—","7.72","8.38","https://www.amazon.co.uk/gp/product/1908058528"
"The New Me","Halle Butler","3.44","3.99","—","—","7.37","3.02","https://www.amazon.co.uk/gp/product/0143133608"
"Afropean: Notes from Black Europe","Johny Pitts","4.11","7.99","20.00","17.20","9.01","7.68","https://www.amazon.co.uk/gp/product/0141984724"
"The Age of Surveillance Capitalism: The Fight for a Human Future at the New Frontier of Power","Shoshana Zuboff","4.09","—","—","—","—","—","https://www.amazon.co.uk/gp/product/1610395697"
"The Wife's Tale: A Personal History","Aida Edemariam","3.62","4.99","—","6.78","8.19","4.61","https://www.amazon.co.uk/gp/product/0062136038"
"Political Tribes: Group Instinct and the Fate of Nations","Amy Chua","4.21","6.71","20.00","20.00","8.19","8.33","https://www.amazon.co.uk/gp/product/0399562850"
"Staying Power: The History of Black People in Britain","Peter Fryer","4.38","6.71","85.00","82.92","10.83","15.72","https://www.amazon.co.uk/gp/product/0861047494"
"Enlightenment Now: The Case for Reason, Science, Humanism, and Progress","Steven Pinker","4.24","9.49","—","—","10.65","10.87","https://www.amazon.co.uk/gp/product/0525427570"
"Alchemy: The Surprising Power of Ideas That Don't Make Sense","Rory Sutherland","4.29","9.99","14.99","15.94","9.99","—","https://www.amazon.co.uk/gp/product/0753556510"
"Working: Researching, Interviewing, Writing","Robert A. Caro","4.43","—","—","15.20","10.32","—","https://www.amazon.co.uk/gp/product/0525656340"
"10 Minutes 38 Seconds in This Strange World","Elif Shafak","4.08","7.99","11.99","12.16","7.49","—","https://www.amazon.co.uk/gp/product/0241293863"
"A Fistful of Shells: West Africa from the Rise of the Slave Trade to the Age of Revolution","Toby Green","4.09","7.99","—","17.72","8.99","9.57","https://www.amazon.co.uk/gp/product/0241003172"
"Middle England (Rotters' Club, #3)","Jonathan Coe","3.97","4.99","18.55","17.25","6.29","2.23","https://www.amazon.co.uk/gp/product/0241309468"
"Metropolis (Bernie Gunther, #14)","Philip Kerr","4.19","4.99","11.93","6.74","8.99","—","https://www.amazon.co.uk/gp/product/1787473201"
"Patsy","Nicole Y. Dennis-Benn","3.83","4.99","12.99","7.00","7.37","7.69","https://www.amazon.co.uk/gp/product/1631495631"
"Wouldn't Take Nothing for My Journey Now","Maya Angelou","4.28","3.99","—","0.47","8.99","0.70","https://www.amazon.co.uk/gp/product/0553380176"
""I Will Not Be Erased": Our stories about growing up as people of colour","gal-dem","4.31","—","—","—","—","—","https://www.amazon.co.uk/gp/product/1406393194"
"This is the Story of a Happy Marriage","Ann Patchett","4.00","6.71","—","8.64","—","2.53","https://www.amazon.co.uk/gp/product/0062236679"
"Bad Behavior","Mary Gaitskill","3.90","4.99","—","59.99","7.37","8.28","https://www.amazon.co.uk/gp/product/0679723277"
"Three Women","Lisa Taddeo","3.70","6.71","16.99","14.08","7.99","—","https://www.amazon.co.uk/gp/product/1451642296"
"Trick Mirror: Reflections on Self-Delusion","Jia Tolentino","4.24","8.99","14.99","—","9.99","—","https://www.amazon.co.uk/gp/product/0525510540"
"Terrific Mother","Lorrie Moore","3.66","1.89","—","—","3.15","1.06","https://www.amazon.co.uk/gp/product/0571351832"
"The Positive Birth Book: A new approach to pregnancy, birth and the early weeks","Milli Hill","4.46","5.62","—","—","14.99","9.99","https://www.amazon.co.uk/gp/product/1780664303"
"Letters from London: Seven Essays by C.L.R. James","C.L.R. James","3.45","—","—","12.00","10.99","1.24","https://www.amazon.co.uk/gp/product/1902669614"
"Beyond A Boundary","C.L.R. James","4.15","5.99","—","100.00","9.01","8.29","https://www.amazon.co.uk/gp/product/022407427X"
"The Black Jacobins: Toussaint L'Ouverture and the San Domingo Revolution","C.L.R. James","4.32","9.99","—","—","14.99","36.80","https://www.amazon.co.uk/gp/product/0679724672"
"Ottolenghi SIMPLE","Yotam Ottolenghi","4.37","9.99","16.72","15.55","—","—","https://www.amazon.co.uk/gp/product/1785031163"
"Our Man in Havana","Graham Greene","3.94","4.99","6.49","5.00","4.35","0.68","https://www.amazon.co.uk/gp/product/0140184937"
"The Heart of the Matter","Graham Greene","3.99","0.96","19.95","—","6.99","3.19","https://www.amazon.co.uk/gp/product/0099478420"
"The Quiet American","Graham Greene","3.97","4.99","—","16.17","7.37","4.64","https://www.amazon.co.uk/gp/product/0143039024"
"Graham Greene: A Life in Letters","Graham Greene","4.09","—","—","27.68","—","16.19","https://www.amazon.co.uk/gp/product/0316727938"
"A Sort Of Life","Graham Greene","3.70","5.49","—","4.31","7.37","0.22","https://www.amazon.co.uk/gp/product/0671782185"
"Middlesex","Jeffrey Eugenides","4.00","3.47","9.55","5.75","6.01","2.45","https://www.amazon.co.uk/gp/product/0312422156"
"The Sisterhood: A Love Letter to the Women Who Have Shaped Me","Daisy Buchanan","3.76","4.99","—","—","8.19","8.93","https://www.amazon.co.uk/gp/product/1472238850"
"The Life and Times of the Thunderbolt Kid","Bill Bryson","3.94","3.99","—","0.15","8.19","4.99","https://www.amazon.co.uk/gp/product/076791936X"
"The Argonauts","Maggie Nelson","4.03","—","—","31.95","—","21.97","https://www.amazon.co.uk/gp/product/1555977073"
"Liquid Rules: The Delightful and Dangerous Substances That Flow Through Our Lives","Mark Miodownik","4.13","—","—","16.87","12.39","—","https://www.amazon.co.uk/gp/product/054485019X"
"Ten Arguments For Deleting Your Social Media Accounts Right Now","Jaron Lanier","3.53","5.49","9.99","5.88","2.69","2.45","https://www.amazon.co.uk/gp/product/1847925391"
"Make It Ahead: A Barefoot Contessa Cookbook","Ina Garten","4.14","14.99","27.50","11.40","—","—","https://www.amazon.co.uk/gp/product/0307464881"
"The Order of Time","Carlo Rovelli","4.08","4.99","—","—","7.37","7.88","https://www.amazon.co.uk/gp/product/073521610X"
"Broad Band: The Untold Story of the Women Who Made the Internet","Claire L.  Evans","3.96","9.99","18.39","16.01","12.94","—","https://www.amazon.co.uk/gp/product/0735211752"
"Heart Berries","Terese Marie Mailhot","3.84","5.78","12.99","7.82","7.37","3.10","https://www.amazon.co.uk/gp/product/1619023342"
"Skin in the Game: Hidden Asymmetries in Daily Life","Nassim Nicholas Taleb","3.86","9.99","—","19.46","8.19","11.46","https://www.amazon.co.uk/gp/product/042528462X"
"Morvern Callar","Alan Warner","3.69","—","—","—","7.99","4.54","https://www.amazon.co.uk/gp/product/038548741X"
"Calypso","David Sedaris","4.15","6.99","13.59","8.05","8.19","8.19","https://www.amazon.co.uk/gp/product/0316392383"
"Transcription","Kate Atkinson","3.49","5.99","16.24","1.99","6.29","1.74","https://www.amazon.co.uk/gp/product/031617663X"
"The Food Explorer: The True Adventures of the Globe-Trotting Botanist Who Transformed What America Eats","Daniel Stone","4.03","3.99","25.00","14.18","11.99","4.73","https://www.amazon.co.uk/gp/product/1101990589"
"The Pragmatic Programmer: From Journeyman to Master","Andy Hunt","4.31","14.85","—","—","—","32.13","https://www.amazon.co.uk/gp/product/020161622X"
"Things I Don't Want to Know","Deborah Levy","4.13","4.99","14.99","14.20","4.00","8.22","https://www.amazon.co.uk/gp/product/1907903631"
"Books v. Cigarettes","George Orwell","3.90","2.99","—","—","—","—","https://www.amazon.co.uk/gp/product/0141036613"
"Why I Write","George Orwell","4.03","—","—","—","—","5.23","https://www.amazon.co.uk/gp/product/0143036351"
"Coming Up for Air","George Orwell","3.79","1.33","—","15.00","8.19","5.00","https://www.amazon.co.uk/gp/product/0156196255"
"Facts Are Subversive: Political Writing from a Decade without a Name","Timothy Garton Ash","3.71","9.98","—","0.50","14.99","—","https://www.amazon.co.uk/gp/product/1848870892"
"The Letters Of Evelyn Waugh","Evelyn Waugh","4.15","—","—","4.66","—","059.95","https://www.amazon.co.uk/gp/product/1857992458"
"Clothes, Clothes, Clothes. Music, Music, Music. Boys, Boys, Boys","Viv Albertine","4.25","4.68","—","39.87","7.37","8.28","https://www.amazon.co.uk/gp/product/0571297757"
"Naked","David Sedaris","4.09","6.99","—","6.99","8.19","9.46","https://www.amazon.co.uk/gp/product/0316777730"
"The Immeasurable World: Journeys in Desert Places","William Atkins","3.48","6.99","16.00","4.99","9.01","5.74","https://www.amazon.co.uk/gp/product/0571319726"
