Title,Author,Goodreads Rating,Kindle Price,Hardcover Price New,Hardcover Price Used,Paperback Price New,Paperback Price New,link
"Sea Room: An Island Life in the Hebrides","Adam Nicolson","3.94","—","—","9.52","8.19","1.57","https://www.amazon.co.uk/gp/product/0865476365"
"The Road to Lichfield","Penelope Lively","3.79","4.99","—","10.40","7.37","4.23","https://www.amazon.co.uk/gp/product/0802136257"
"To Be a Machine : Adventures Among Cyborgs, Utopians, Hackers, and the Futurists Solving the Modest Problem of Death","Mark O'Connell","3.79","6.99","—","14.15","8.19","3.82","https://www.amazon.co.uk/gp/product/0385540418"
"The Wife","Meg Wolitzer","3.69","—","—","—","—","—","https://www.amazon.co.uk/gp/product/0743456661"
"Man's Search for Meaning","Viktor E. Frankl","4.36","4.99","10.65","13.99","—","9.99","https://www.amazon.co.uk/gp/product/080701429X"
"Utopia Parkway: The Life and Work of Joseph Cornell","Deborah Solomon","4.07","9.60","—","11.28","12.63","13.46","https://www.amazon.co.uk/gp/product/0878466843"
"The House of Wittgenstein: A Family at War","Alexander Waugh","3.74","8.60","—","8.05","10.59","0.70","https://www.amazon.co.uk/gp/product/0385520603"
"Lincoln in the Bardo","George Saunders","3.76","5.78","15.19","1.59","7.37","3.10","https://www.amazon.co.uk/gp/product/0812995341"
"Resurrection Bay (Caleb Zelic, #1)","Emma Viskic","3.77","—","—","—","—","—","https://www.amazon.co.uk/gp/product/1760068769"
"Building Microservices: Designing Fine-Grained Systems","Sam Newman","4.18","20.75","—","—","24.11","17.95","https://www.amazon.co.uk/gp/product/1491950358"
"Dear Ijeawele, or a Feminist Manifesto in Fifteen Suggestions","Chimamanda Ngozi Adichie","4.53","2.99","10.00","5.16","4.29","5.66","https://www.amazon.co.uk/gp/product/152473313X"
"How Dare the Sun Rise: Memoirs of a War Child","Sandra Uwiringiyimana","4.27","—","12.72","4.66","7.74","3.09","https://www.amazon.co.uk/gp/product/0062470140"
"Believe Me: A Memoir of Love, Death, and Jazz Chickens","Eddie Izzard","3.82","7.99","—","0.70","7.37","0.70","https://www.amazon.co.uk/gp/product/0399175830"
"The Alice Network","Kate Quinn","4.28","6.99","—","—","9.01","6.20","https://www.amazon.co.uk/gp/product/0062654195"
"Let Us Now Praise Famous Men","James Agee","4.05","—","—","37.12","14.99","—","https://www.amazon.co.uk/gp/product/0141188499"
"Lit","Mary Karr","3.92","6.99","—","9.45","10.99","5.99","https://www.amazon.co.uk/gp/product/0060596988"
"Me Talk Pretty One Day","David Sedaris","3.99","5.99","—","7.61","8.19","5.79","https://www.amazon.co.uk/gp/product/0349113912"
"All Over But the Shoutin'","Rick Bragg","4.11","—","—","—","—","2.13","https://www.amazon.co.uk/gp/product/0679774025"
"This Boy's Life","Tobias Wolff","3.98","—","—","10.16","9.99","1.38","https://www.amazon.co.uk/gp/product/0802136680"
"The Woman Warrior","Maxine Hong Kingston","3.73","—","—","—","—","1.18","https://www.amazon.co.uk/gp/product/0679721886"
"Existential Psychotherapy","Irvin D. Yalom","4.39","20.99","38.80","29.19","—","—","https://www.amazon.co.uk/gp/product/0465021476"
"You Don't Look Your Age...and Other Fairy Tales","Sheila Nevins","3.36","—","—","—","—","—","https://www.amazon.co.uk/gp/product/1250111323"
"Universal Harvester","John Darnielle","3.24","7.59","—","2.19","8.45","5.22","https://www.amazon.co.uk/gp/product/0374282102"
"Words for a Deaf Daughter","Paul West","3.83","—","—","11.80","—","—","https://www.amazon.co.uk/gp/product/0385231164"
"Redemption Road","John Hart","4.08","3.99","—","—","7.99","2.96","https://www.amazon.co.uk/gp/product/0312380364"
"Green Island","Shawna Yang Ryan","3.99","7.99","—","8.78","13.99","11.52","https://www.amazon.co.uk/gp/product/1101874252"
"Gut Instinct: What Your Stomach is Trying to Tell You","Pierre Pallardy","3.35","7.49","—","—","—","1.06","https://www.amazon.co.uk/gp/product/1594865426"
"The Great Divorce","C.S. Lewis","4.29","0.99","—","19.34","3.45","—","https://www.amazon.co.uk/gp/product/0006280560"
"East of Eden","John Steinbeck","4.38","3.99","—","29.78","7.37","8.28","https://www.amazon.co.uk/gp/product/0142000655"
"Teaching My Mother How to Give Birth","Warsan Shire","4.31","2.70","—","—","4.00","3.32","https://www.amazon.co.uk/gp/product/1905233299"
"Her Blue Body","Warsan Shire","4.64","—","—","—","—","—","https://www.amazon.co.uk/gp/product/1905233485"
"The Moon Reminded Me","Ellen Grace O'Brian","3.97","—","—","—","9.05","8.56","https://www.amazon.co.uk/gp/product/1938846990"
"Salt: A World History","Mark Kurlansky","3.74","6.99","—","15.64","9.01","5.00","https://www.amazon.co.uk/gp/product/0142001619"
"The Course of Love","Alain de Botton","4.05","4.99","—","29.99","8.99","—","https://www.amazon.co.uk/gp/product/0241145473"
"On Love","Alain de Botton","3.98","—","—","27.08","11.35","12.19","https://www.amazon.co.uk/gp/product/0802142400"
"The Examined Life: How We Lose and Find Ourselves","Stephen Grosz","3.91","3.99","—","3.99","8.19","4.99","https://www.amazon.co.uk/gp/product/0393349322"
"Status Anxiety","Alain de Botton","3.91","5.99","—","1.69","8.24","3.00","https://www.amazon.co.uk/gp/product/0375725350"
"Sérgio Y. vai à América","Alexandre Vidal Porto","3.87","—","—","—","—","—","https://www.amazon.co.uk/gp/product/8566382013"
"Boomerang: Travels in the New Third World","Michael   Lewis","3.90","—","—","2.37","—","7.56","https://www.amazon.co.uk/gp/product/0393343448"
"Feel the Fear and Do It Anyway","Susan  Jeffers","4.03","6.99","14.99","12.16","7.37","4.65","https://www.amazon.co.uk/gp/product/0449902927"
"The Art of Living: The Classical Manual on Virtue, Happiness and Effectiveness","Epictetus","4.23","4.99","—","14.89","7.99","8.43","https://www.amazon.co.uk/gp/product/006251346X"
"Don't Make Me Think, Revisited: A Common Sense Approach to Web Usability","Steve Krug","4.25","12.99","—","—","24.76","27.18","https://www.amazon.co.uk/gp/product/0321965515"
"TED Talks: The Official TED Guide to Public Speaking","Chris J. Anderson","4.16","7.99","—","37.34","8.99","2.32","https://www.amazon.co.uk/gp/product/0544634497"
"Ultimate Questions","Bryan Magee","3.99","8.32","11.66","12.26","8.76","9.37","https://www.amazon.co.uk/gp/product/0691170657"
"How to Fail at Almost Everything and Still Win Big: Kind of the Story of My Life","Scott Adams","4.10","9.99","—","27.95","10.99","8.49","https://www.amazon.co.uk/gp/product/1591846919"
"The Man with a Shattered World: The History of a Brain Wound","Alexander R. Luria","4.11","—","—","46.58","—","15.04","https://www.amazon.co.uk/gp/product/0674546253"
"The Lives of Others","Neel Mukherjee","3.65","4.99","—","0.50","8.19","1.06","https://www.amazon.co.uk/gp/product/0393351718"
"The Grapes of Wrath","John Steinbeck","3.96","0.99","—","—","7.37","8.28","https://www.amazon.co.uk/gp/product/067001690X"
"A Short Guide to a Happy Life","Anna Quindlen","3.95","2.49","11.21","—","—","—","https://www.amazon.co.uk/gp/product/0375504613"
"Child's Talk: Learning to Use Language","Jerome Bruner","4.00","—","—","—","15.48","3.89","https://www.amazon.co.uk/gp/product/0393953459"
"Failure is Not an Option: Mission Control From Mercury to Apollo 13 and Beyond","Gene Kranz","4.27","—","—","46.26","—","13.76","https://www.amazon.co.uk/gp/product/0425179877"
"The Demon-Haunted World: Science as a Candle in the Dark","Carl Sagan","4.27","—","19.66","19.66","—","14.96","https://www.amazon.co.uk/gp/product/0345409469"
"Seeing Further: Ideas, Endeavours, Discoveries and Disputes — The Story of Science Through 350 Years of the Royal Society","Bill Bryson","3.58","3.99","—","9.99","8.19","3.53","https://www.amazon.co.uk/gp/product/0007302568"
"Thinking, Fast and Slow","Daniel Kahneman","4.15","7.99","22.87","30.78","10.49","5.01","https://www.amazon.co.uk/gp/product/0374275637"